article_url,article_time,article_head,article_author,article_content
https://tjournal.ru/tech/59113-lyrebird-servis-sinteziruyushchiy-golos-cheloveka-s-pomoshchyu-iskusstvennogo-intellekta,06.09.2017 12:50:21 (Europe/Moscow),"Lyrebird: сервис, синтезирующий голос человека с помощью искусственного интеллекта",Технологии," Который может и не сработать после того, как вы начитаете для него 30 необходимых предложений. Команда канадского стартапа Lyrebird Ранее разработчики уже показывали примеры работу их технологии в экспериментальном порядке, записав искусственную беседу между Бараком Обамой, Дональдом Трампом и Хиллари Клинтон. Теперь попробовать Lyrebird сможет любой желающий. Однако вместо Редакция TJ опробовала механизм, но столкнулась с несколькими проблемами при использовании его веб-версии: записи предложений достаточно часто отказывались загружаться, а в двух из пяти случаев программа не смогла обработать полученные аудиофайлы. "
https://tjournal.ru/flood/44837-neyroset-nauchili-iskat-pornoaktris-po-foto,30.05.2017 11:43:30 (Europe/Moscow),Нейросеть научили искать порноактрис по фото,Офтоп," Заблокированные на территории России порносайты Brazzers и Reality Kings приспособили нейросети для поиска порноактрис буквально на любой вкус. Он работает по тому же принципу, что и приложение FindFace, позволяющее найти людей в соцсетях. "
https://tjournal.ru/flood/45042-neyroset-prevrashchaet-risunki-v-fotorealistichnye-portrety,05.06.2017 19:04:40 (Europe/Moscow),Нейросеть превращает рисунки в фотореалистичные портреты,Офтоп," Лучше вам этого не видеть. Команда проекта Pix2pix С помощью сотен работ слушателей журналисты начали обучать нейросеть, а в мае показали инструмент pix2pix. По их словам, изображения других людей не использовались, а значит каждый рисунок пользователей алгоритм будет пытаться «превратить» в ведущую. Несмотря на это, в Твиттере начали пытаться нарисовать свои портреты. Правда, большинство результатов работы алгоритма, скорее, можно назвать кошмарными, чем реалистичными. Также в Твиттере попробовали нарисовать знаменитых персонажей вроде Рика из мультсериала «Рик и Морти» и Спанч Боба. Позже на алгоритм обратили внимание и российские пользователи. "
https://tjournal.ru/tech/57884-yuzhnokoreyskie-uchenye-nauchili-iskusstvennyy-intellekt-opredelyat-spory-sibirskoy-yazvy,08.08.2017 12:58:10 (Europe/Moscow),Южнокорейские учёные научили искусственный интеллект определять споры сибирской,Технологии," Таким образом планируют бороться с угрозой биологического оружия. Учёные из Южной Кореи Специалисты из южнокорейского института передовых технологий Голографическую микроскопию решили применять из-за того, что структура и состав клетки могут меняться в зависимости от освещения, и такой метод помог бы обнаружить разницу между спорами антракса и похожими, но менее опасными бактериями. Южнокорейский учёный ЙонКен Парк и группа специалистов «научили» искусственный интеллект определять ключевую разницу между бактериями в более чем 400 спорах, взятых у пяти разных видов бактерий. Одним из образцов был штамм антракса, ещё четыре обладали похожими характеристиками. Учёные не «объяснили» алгоритму, как именно нужно выявлять разные образцы — он «понял» это самостоятельно. После нескольких пробных попыток, он смог отличить споры антракса от подобных ему с точностью в 96%. Вычисления производятся быстрее, чем за секунду. Сейчас один из самых распространённых методов выявления антракса — анализ генетического материала, содержащегося в спорах, либо анализ бактерий, взятых из тканей заражённого организма. Обычно для этого спорам необходимо некоторое время для развития, чтобы собрать больше генетического материала. По словам Парка, метод не идеален, но должен работать как средство обнаружения биологического оружия. Сейчас алгоритм может распознать только один штамм во взятом образце, и тонкие различия между ними могут сбить его с толку. Парк намерен работать над точностью вычислений за счёт предоставления нейросети других образцов для анализа. Антракс — заболевание, которое вызывает штамм сибирской язвы. Люди могут заразиться им случайно, при разделывании шкур или мяса больных животных. При этом, антракс может быть опасным биооружием: в 2001 году споры антракса были"
https://tjournal.ru/flood/46320-badoo-zapustil-poisk-dvoynikov-znamenitostey-i-obychnyh-polzovateley,12.07.2017 20:11:31 (Europe/Moscow),Badoo запустил поиск двойников знаменитостей и обычных,Офтоп," Проверили, можно ли с помощью сервиса найти партнёра, похожего на Усманова, Цукерберга или Медведева. В приложении для знакомств Badoo Разработчики не раскрыли, на основе какой технологии построено распознавание лиц пользователей. «Мы изучили все подобные решения на рынке, со всеми нашими доработками и идеями получился уникальный продукт», — рассказали TJ в Badoo. Чтобы найти своего двойника, нужно открыть поиск в Badoo и либо добавить фото, либо использовать снимок из профиля. Сервис также предлагает посмотреть на пользователей, похожих на знаменитых людей, вроде Эммы Стоун или Веры Брежневой. TJ пропустил через алгоритм Badoo снимки популярных политиков, музыкантов, спортсменов, глав крупных IT-компаний и актёров, чтобы проверить, найдутся ли к ним двойники. Профили большинства звёзд уже есть в базе сервиса, но для поиска некоторых необходимо загрузить фотографию, желательно портретного типа. P. S. Прости, Мусалав!"
https://tjournal.ru/flood/43372-sberbank-pokazal-pervoe-stihotvorenie-svoey-neyroseti,18.04.2017 14:52:13 (Europe/Moscow),Сбербанк показал первое стихотворение своей нейросети,Офтоп," Глава управления инструментов и моделей Сбербанка Максим Еременко Сотрудник банка пояснил, что разработанную ими нейросеть, будут использовать для «роботизированного анализа неструктурированных данных», а также планируют использовать для автоматизации кол-центров, чат-ботов, мессенджеров и генерации исковых заявлений. 12 января 2017 года в Сбербанке Что касается написания стихов, то нейросеть, по словам Еременко, писала их «на классиках русской литературы». Сначала она, «пыталась комбинировать слогами», через месяц начала писать «правильными словами» и пыталась «подбирать рифмы». На сегодняшний день она «умеет писать полноценные стихи четырёхстопным ямбом». С улыбкой нежной и всеми наравне, Могучим, полным воздух стал без слов, Наш протокол в столь светлый вечер страстный, Для чего нейросеть Сбербанка научили писать стихи представитель коммерческой организации не пояснил. В июле 2016 года компания «Яндекс» "
https://tjournal.ru/flood/46069-iskusstvennyy-intellekt-nauchilsya-sozdavat-kartiny-s-nulya-v-unikalnyh-stilyah,04.07.2017 17:10:44 (Europe/Moscow),Искусственный интеллект научился создавать картины «с нуля» в уникальных стилях,Офтоп," Ученые из Ратгерского университета лаборатории Facebook’s AI сумели научить искусственный интеллект Еще недавно прорывом считалось то, что нейросети В своей работе учёные из лаборатории Facebook обучили искусственный интеллект (ИИ) на основании 80 тысяч картин. Первой задачей было, чтобы программа смогла отличать картины от других изображений: графиков и фотографий. На следующем этапе ИИ научился различать стили живописи и был способен отличить Поп-арт от Кубизма или Импрессионизма. Получив такие навыки, программа смогла начать рисовать картины «с нуля», постоянно совершенствуя их, смешивая техники и создавая собственный стиль. Сто лучших картин созданных и выбранных самим ИИ были показаны любителям искусства вперемешку с картинами экспрессионистов начала века и избранными работами участников выставки Результаты опроса весьма интересны, считает Кевин Уокер ( Изображения, оцененные крайне высоко, содержат эстетически сочетание цветов и узоров, а картины, получившие плохие оценки, более однородны. Более того, Уокер сказал, что креативная машина уже создаёт работы для галерей. Например, двое его учеников в настоящий момент экспериментируют с ИИ, который способен перенимать их стиль рисования, чтобы создавать собственные работы. Одна из учениц использовала эту технологию, чтобы создать кадры для "
