article_url,article_time,article_head,article_author,article_content
https://tjournal.ru/tech/85292-v-shveycarii-robota-nauchili-bystree-begat-i-podnimatsya-posle-padeniy-tolko-s-pomoshchyu-neyrosetey,18.01.2019 23:35:45 (Europe/Moscow),В Швейцарии робота научили быстрее бегать и подниматься после падений только с помощью,Технологии," «Чёрное зеркало» всё ближе. Обычно движения роботов программируют вручную, но швейцарский робопёс ANYmal Исследователи использовали симуляции: две тысячи ANYmal в виртуальной среде учились двигаться наиболее эффективно. Это позволило обучить роботов в тысячу раз быстрее, чем в реальной жизни. После того, как данные загрузили в настоящего робота, он начал бегать на 25% быстрее предшественников."
https://tjournal.ru/science/122798-rozhdenie-rebenka-sohranyaet-molodost-zhenskogo-mozga,25.10.2019 11:29:25 (Europe/Moscow),Рождение ребенка сохраняет молодость женского мозга,Наука," Сравнив с помощью нейросети МРТ-сканы мозга 12 тысяч женщин, норвежские ученые Исследователи выяснили, что у женщин, имеющих одного ребенка, мозг моложе почти на пять месяцев, чем у нерожавших женщин. В случае с двумя детьми разница составляла уже полгода, с тремя — девять месяцев. Ученые отметили, что омолаживающий эффект постепенно снижается в зависимости от количества детей. После пятого ребенка различия становятся менее выраженными. Определять возраст мозга с помощью нейросетей ученые научились несколько лет назад. С тех, пор, например, они выяснили, что женский мозг в среднем на 3-4 года моложе мужского. В течение беременности организм женщины адаптируется под потребности плода. В частности, организм экономит на работе мозга. В этот период у женщин тормозится процесс образования новых нервных клеток (нейрогенез) и наблюдается снижение объема мозга. После родов нейрогенез усиливается и мозговые структуры возвращаются к исходному состоянию. Ранее было ""Мы вовсе не хотим сказать, что беременность заставляет вас терять мозг, это не так, - отметила доктор Элселин Хуксема в "
https://tjournal.ru/tech/99162-v-kitayskih-detskih-sadah-ispolzuyut-robota-dlya-ezhednevnogo-osmotra-detey-na-priznaki-bolezney,28.05.2019 03:17:11 (Europe/Moscow),В китайских детских садах используют робота для ежедневного осмотра детей на признаки,Технологии," Если он находит симптомы — отправляет ребёнка к врачу. Более двух тысяч детских садов в Китае каждый день Робот оснащён камерами, термометром, и натренирован искать признаки вроде конъюнктивита, лихорадки или сыпи с помощью нейросетей. В случае обнаружение симптомов ребёнка сразу отправляют к медсестре или преподавателю, который может отпустить его домой. Таким образом власти снижают распространение инфекций среди детей. Кроме того, решается проблема с нехваткой квалифицированных специалистов в некоторых отдалённых регионах."
https://tjournal.ru/tech/105007-v-mit-sozdali-instrument-dlya-redaktirovaniya-izobrazheniy-v-odin-klik-kotoryy-mozhet-ne-podchinyatsya-komandam-cheloveka,05.07.2019 04:26:05 (Europe/Moscow),"В MIT создали инструмент для редактирования изображений «в один клик», который может не подчиняться командам",Технологии," Можно превратить асфальт в газон или замазать лишний объект на фото, если это не противоречит физике. Исследователи из MIT и IBM По словам профессора MIT Антонио Торральбы, инструмент обладает «строгой индивидуальностью» и не станет выполнять действия, если посчитает, что они не подходят для изображения. Все приложения для рисования следуют инструкциям пользователей, но наше может решить не рисовать ничего, если человек пытается поместить объект в невозможное положение. Это инструмент для рисования со строгой индивидуальностью и он открывает окно, которое позволит понять, как генеративные состязательные нейросети представляют визуальный мир. Демонстрацию работы приложения разместили на отдельном Чаще всего результат выходит реалистичным, а при противоречии с реальным миром алгоритм не меняет ничего на изображении. В некоторых случаях нейросеть оставляет артефакты на картинках — алгоритм пока не совершенен. Для создания инструмента использовали нейросеть, состоящую из двух частей. Одна генерирует примеры реалистичных фотографий, а другая пытается найти разницу между сгенерированной картинкой и реальной. Таким образом модель совершенствуется и учится выдавать изображения определённого уровня реалистичности."
https://tjournal.ru/tech/88139-thispersondoesnotexist-mozhno-li-otlichit-lico-nastoyashchego-cheloveka-ot-sgenerirovannogo-neyrosetyu,15.02.2019 15:44:05 (Europe/Moscow),ThisPersonDoesNotExist: можно ли отличить лицо настоящего человека от сгенерированного,Технологии," Алгоритм от Nvidia позволяет создать лицо несуществующего человека за несколько секунд. И оно выглядит реалистично. 10 февраля компания Nvidia 14 февраля 2019 года разработчик Uber Филипп Ванг запустил сайт Западные СМИ TJ предлагает читателям проверить себя. В каждом коллаже три фото: два лица настоящих, а одно — сгенерировано на сайте ThisPersonDoesNotExist. Ответы можно подсмотреть, нажав на снимок."
https://tjournal.ru/tech/128433-byvshiy-chempion-po-go-li-sedol-obyavil-ob-uhode-iz-sporta-iz-za-prevoshodstva-iskusstvennogo-intellekta,27.11.2019 18:11:32 (Europe/Moscow),Бывший чемпион по го Ли Седоль объявил об уходе из спорта из-за превосходства искусственного,Технологии," По его словам, теперь всегда есть «сущность, которую нельзя победить». Южнокорейский чемпион по го Ли Седоль объявил об уходе из профессиональной игры. Он назвал причиной решения превосходство искусственного интеллекта в соревнованиях. Об этом С дебютом ИИ в играх по го я понял, что я больше не лучший. И даже если стану номером один за счёт безумных усилий, теперь есть сущность, которую не одолеть. При этом согласно Yonhap, Седоль всё же сыграет как минимум один матч в го, чтобы отметить уход из профессиональной игры. В декабре он планирует посоревноваться с южнокорейским ИИ HanDol, которая победила пятерых лучших игроков в стране. Седоль получит преимущество «в два камня», однако он не уверен, что даже с ним сможет победить систему в первом матче. По словам игрока, он собирается спокойно соревноваться с ИИ, хоть и сделает всё возможное для победы. Многие годы го считалась одной из самых сложных игр для ИИ, так как количество комбинаций в ней больше, чем атомов в наблюдаемой вселенной. Однако в 2016 году система AlphaGo от DeepMind впервые В конце 2000-х Седоль считался лучшим игроком в го в мире. Он считал, что победит ИИ и публично В 2017 году DeepMind Спустя три дня после такого обучения, система начала играть на «сверхчеловеческой» скорости и победила предшественника в 100 играх против нуля. По данным DeepMind, AlphaGo Zero является сильнейшим игроком в го в мировой истории."
https://tjournal.ru/flood/86349-neyroset-google-sygrala-v-starcraft-ii-s-professionalnymi-geymerami-lyudi-vyigrali-odnu-partiyu-iz-11,25.01.2019 11:12:34 (Europe/Moscow),Нейросеть Google сыграла в StarCraft II с профессиональными геймерами. Люди выиграли одну партию из,Офтоп," Единственный удачный раунд для человечества был уже «утешительным». Алгоритм AlphaStar, разработанный подразделением Alphabet DeepMind (создатели нейросети, Серия матчей проходила ещё в декабре 2018 года, но подробностями DeepMind Игра, представляющая собой стратегию в реальном времени, считалась большим вызовом для разработчиков алгоритма. Нейросеть тренировали по «турнирному принципу»: множество версий AlphaStar играли между собой и обучались друг на друге, и пять лучших версий в итоге выставили против людей. Нейросеть в турнире против игроков получила некоторые ограничения: например, ей запрещали совершать больше действий в минуту, чем может человек. Но было и преимущество — AlphaStar видела всю карту целиком (но при этом действовал «туман войны»), а человеку приходилось её перемещать. В январе 2019 года противников уравняли в этой функции, после чего Коминц единственный раз обыграл алгоритм в прямом эфире товарищеского матча."
https://tjournal.ru/tech/124832-adobe-predstavila-instrumenty-dlya-ozhivleniya-statichnyh-kartinok-i-proverki-snimkov-na-fotoshop,08.11.2019 22:27:10 (Europe/Moscow),Adobe представила инструменты для оживления статичных картинок и проверки снимков «на,Технологии," Обе функции работают с помощью машинного обучения. На конференции MAX 2019 Adobe Благодаря инструменту Project Sweet Talk пользователи могут заанимировать статичный портрет человека или любого другого существа, даже героя комикса. Для оживления картинки достаточно записи голоса: система сама переведёт речь в анимацию рта и головы. При разработке инструмента использовали тысячи часов видео с говорящими на камеру людьми для обучения алгоритма с YouTube. К удивлению исследователей, в результате система смогла отлично справляться не только с человеческими лицами, но и с рисованными животными и другими существами. Как пояснили исследователи, алгоритм не получится использовать для создания реалистичных дипфейков с настоящими лицами. По их словам, для этого система пока слишком слабо обучена. Adobe также представила инструменты на основе ИИ, которые распознаёт манипуляции с изображениями и аудио. Функция Инструмент Adobe также показала две функции для работы со звуком. Инструмент"
https://tjournal.ru/tech/118157-google-opublikovala-tri-tysyachi-dipfeykov-dlya-borby-s-dipfeykami,26.09.2019 20:56:42 (Europe/Moscow),Google опубликовала три тысячи дипфейков для борьбы с,Технологии," Исследователи могут использовать данные для обучения автоматических алгоритмов распознавания подделок. Google выпустила базу данных с тысячами дипфейков для поддержки разработчиков, создающих инструменты обнаружения подделок. Для этого компания сняла сотни видео с актёрами и сделала дипфейки с помощью публично доступных методов. Об этом сотрудники Google Исследователи могут использовать датасет Google для тренировки автоматических систем распознавания дипфейков. Благодаря набору данных разработчики смогут повысить точность и эффективность инструментов, насколько это возможно. В Google пообещали добавлять новые ролики в базу, чтобы справляться с развитием алгоритмов генерации дипфейков. Поскольку область быстро развивается, мы будем дополнять датасет по мере развития технологии дипфейков, а также продолжим работать с партнёрами в этой сфере. Мы твёрдо верим в поддержку сообщества исследователей, борющихся против потенциального вреда синтетических медиа. Google — не единственная технологическая компания, выступившая против дипфейков. Facebook и Microsoft также"
https://tjournal.ru/tech/82264-v-nvidia-nauchili-neyroset-generirovat-neotlichimye-ot-realnyh-lica-lyudey,15.12.2018 22:34:37 (Europe/Moscow),В Nvidia научили нейросеть генерировать неотличимые от реальных лица,Технологии, Алгоритм умеет
https://tjournal.ru/internet/114336-v-kitae-nabralo-populyarnost-deepfake-prilozhenie-zao-ono-pozvolyaet-vstavit-svoe-lico-v-video-za-neskolko-sekund,02.09.2019 11:32:28 (Europe/Moscow),В Китае набрало популярность DeepFake-приложение Zao — оно позволяет вставить своё лицо в видео за несколько,Интернет и мемы," Одно селфи, пара нажатий — и вот ты уже заменяешь Ди Каприо во всех его фильмах. В соцсетях отметили «пугающий» потенциал технологии. В конце августа в Китае запустилось приложение Zao, позволяющее с помощью всего лишь одного фото (при желании — серии фото) подставить своё лицо в видео. В отличие от сервиса DeepFake, где нейросеть надо было обучать на десятках снимков в течение нескольких часов, в Zao весь процесс занимает считанные секунды. Приложение быстро заняло лидирующие позиции в топе App Store Китая, но в то же время вызвало беспокойство в соцсетях. Пока Zao доступно только для китайских пользователей, поэтому редакции TJ не удалось его проверить. Но в Твиттере появилось несколько примеров работы технологии. Разработчик Аллан Хиа, к примеру, продемонстрировал, насколько легко заменить лицо Леонардо Ди Каприо другим. Обработка видео, по его словам, заняла примерно восемь секунд. Результат не всегда получается «на 100% точным», но, в целом, приложение для своей скорости обработки справляется хорошо, отметил разработчик. При желании можно заменить вообще всех персонажей на видео — так он поступил с отрывком из «Игры Престолов». Также технология работает и с видеоиграми. При этом в Zao нельзя подставить своё лицо абсолютно в любое видео — необходимо выбрать из уже существующей библиотеки роликов. По словам пользователей, она довольно обширная и включает в себя фильмы, сериалы, ТВ-шоу, клипы и катсцены из игр. Скорее всего, разработчики просто хорошо натренировали алгоритм именно на этих роликах, поэтому технология выдаёт неплохие результаты. Хиа отметил, что в приложении есть отдельный раздел для генерации мемов со своим участием. Несмотря на существующие ограничения, разработчик в треде пофантазировал о том, как может развиться технология: ты играешь роли в фильмах, стримеры проходят игры за «себя». «Если Pornhub ещё не работает над реализацией чего-то подобного, то им точно стоит обсудить это», — добавил он. В то же время Аллан подчеркнул и «моральную сторону вопроса». «Я вижу очень много вариантов, при которых технология может повернуть не туда», — написал один из комментаторов в Твиттере. За несколько дней разработчики Zao уже успели попасть в скандал. По"
https://tjournal.ru/tech/94914-moddery-nachali-ispolzovat-iskusstvennyy-intellekt-dlya-uluchsheniya-grafiki-v-igrah,26.04.2019 04:17:51 (Europe/Moscow),Моддеры начали использовать искусственный интеллект для улучшения графики в,Технологии," То, что раньше занимало годы работы десятков людей, теперь может сделать один человек за пару недель. В ноябре 2018 года на сцене модификаций игр Для улучшения графики Процесс пока не автоматический, к тому же алгоритмы работают не со всеми играми, однако даже в таком состоянии позволяют ускорить обновление игры. Моддеры и раньше применяли апскейлинг, но им приходилось делать всё вручную. Один проект мог занимать несколько лет и требовал участия десятков людей. Это почти как магия. Это выглядит как будто я просто загружаю пакет текстур в высоком разрешении с сайта Bethesda. Участники сцены модификации игр общаются и кооперируются в отдельном За последнее время с помощью ИИ моддеры обновили графику в Doom, Half-Life 2, Metroid Prime 2, Final Fantasy VII, GTA: Vice City и Mass Effect 2. Чтобы получить улучшения, достаточно установить модификацию соответствующей игры."
